{
  "title": "How was {event}? 4 minutes to decide what we keep next time",
  "description": "A short feedback survey for everyone who registered for {event}, our virtual developer conference.",
  "kind": "feedback",
  "audience": "People who registered for {event} (about 300 developers), whether they watched live or on recording",
  "purpose": "Decide which session types to keep or drop, and whether to run {event} again next year",
  "sponsor": "{event} organising team",
  "language": "en",
  "welcome": {
    "title": "How was {event}?",
    "description": "Thanks for joining us. We're the organising team, and your answers decide which sessions we keep, which we drop, and whether we run {event} again.\n• For everyone who registered, live or on recording\n• Takes about 4 minutes\n• Anonymous: we only look at answers in summary\n• Voluntary: you can stop at any time\n• Open until {date}. Questions? {contact}",
    "button": "Start"
  },
  "thank_you": {
    "title": "Thank you, that helps a lot",
    "description": "We'll email every registrant a summary of the feedback and our decision about next year by {date}. Questions? {contact}"
  },
  "settings": {"stated_minutes": 4, "progress_bar": true, "anonymous": true},
  "questions": [
    {"ref": "Q1", "type": "single_choice", "intent": "screener", "required": true,
     "label": "How did you watch {event}?",
     "options": ["Mostly live", "Partly live, partly on recording", "Only on recording", "I registered but didn't watch any of it"],
     "jumps": [{"when": "Q1 is 'I registered but didn''t watch any of it'", "to": "end"}]},
    {"ref": "Q2", "type": "nps", "intent": "outcome", "required": true,
     "label": "How likely are you to recommend {event} to a friend or colleague?",
     "scale": {"min": 0, "max": 10, "labels": {"0": "Not at all likely", "10": "Extremely likely"}}},
    {"ref": "Q3", "type": "long_text", "intent": "open_feedback", "required": false,
     "label": "What is the main reason for your score?"},
    {"ref": "Q4", "type": "statement", "role": "information",
     "label": "Next: the sessions"},
    {"ref": "Q5", "type": "matrix", "intent": "attitude", "required": false,
     "label": "How valuable or not valuable was each type of session to you?",
     "description": "Leave a row blank if you didn't watch that type.",
     "rows": ["Keynotes", "Technical talks", "Live coding demos", "Hands-on workshops", "Panel discussions", "Ask-me-anything sessions"],
     "columns": ["Not at all valuable", "Slightly valuable", "Moderately valuable", "Very valuable", "Extremely valuable"]},
    {"ref": "Q6", "type": "multi_choice", "intent": "attitude", "required": false,
     "label": "Which session types would you drop or shorten next time? Select all that apply.",
     "options": ["Keynotes", "Technical talks", "Live coding demos", "Hands-on workshops", "Panel discussions", "Ask-me-anything sessions"],
     "has_none": true},
    {"ref": "Q7", "type": "statement", "role": "information",
     "label": "Next: the online experience and next year"},
    {"ref": "Q8", "type": "likert", "intent": "attitude", "required": false,
     "label": "How satisfied or dissatisfied were you with the online event platform?",
     "scale": {"min": 1, "max": 5, "labels": {"1": "Very dissatisfied", "2": "Dissatisfied", "3": "Neither satisfied nor dissatisfied", "4": "Satisfied", "5": "Very satisfied"}}},
    {"ref": "Q9", "type": "single_choice", "intent": "outcome", "required": false,
     "label": "If we run {event} again next year, how likely or unlikely are you to attend?",
     "options": ["Very unlikely", "Unlikely", "Not sure", "Likely", "Very likely"]},
    {"ref": "Q10", "type": "long_text", "intent": "open_feedback", "required": false,
     "label": "What one change would most improve the next edition?"},
    {"ref": "Q11", "type": "single_choice", "intent": "demographic", "required": false,
     "label": "Which best describes your role?",
     "description": "So we can plan sessions for the people who come.",
     "options": ["Software developer or engineer", "Engineering manager", "DevOps or platform engineer", "Data or ML engineer", "Student"],
     "has_other": true, "has_prefer_not_to_answer": true}
  ]
}
